{
  "schema": "folder-sync-changes/1",
  "project": "notes",
  "host_id": "b55e9683-7854-4121-a56a-9bae7c3ab1da",
  "host_name": "bam-GPU",
  "seq": 43,
  "at": "2026-10-28T20:41:00.431Z",
  "by": "machine",
  "events": [
    {
      "schema": "folder-sync-event/1",
      "event": "upload",
      "at": "2026-10-28T20:41:00.418Z",
      "level": "info",
      "project": "notes",
      "host": "b55e9683-7854-4121-a56a-9bae7c3ab1da",
      "host_name": "bam-GPU",
      "seq": 43,
      "path": "logs/agent.log",
      "size": 88123,
      "sha256": "1234567890abcdef1234567890abcdef1234567890abcdef1234567890abcdef",
      "op": "edit",
      "was": {
        "sha256": "fedcba0987654321fedcba0987654321fedcba0987654321fedcba0987654321",
        "size": 80001,
        "written_at": "2026-10-28T20:30:00.000Z",
        "kept": null,
        "why": "no_history"
      },
      "up_ms": 414
    },
    {
      "schema": "folder-sync-event/1",
      "event": "upload",
      "at": "2026-10-28T20:41:00.402Z",
      "level": "info",
      "project": "notes",
      "host": "b55e9683-7854-4121-a56a-9bae7c3ab1da",
      "host_name": "bam-GPU",
      "seq": 43,
      "path": "notes/new-idea.md",
      "size": 311,
      "sha256": "4a1f0c9e8d7b6a5f4e3d2c1b0a9f8e7d6c5b4a3f2e1d0c9b8a7f6e5d4c3b2a1f",
      "op": "add",
      "up_ms": 398
    },
    {
      "schema": "folder-sync-event/1",
      "event": "delete",
      "at": "2026-10-28T20:41:00.420Z",
      "level": "info",
      "project": "notes",
      "host": "b55e9683-7854-4121-a56a-9bae7c3ab1da",
      "host_name": "bam-GPU",
      "seq": 43,
      "path": "notes/old-ideas.md",
      "was": {
        "sha256": "5555666677778888999900001111222233334444555566667777888899990000",
        "size": 5121,
        "written_at": "2026-10-21T09:12:44.500Z",
        "kept": "2026-10-21T09:12:44.500Z_5555666677778888"
      },
      "up_ms": 1203
    },
    {
      "schema": "folder-sync-event/1",
      "event": "upload",
      "at": "2026-10-28T20:41:00.410Z",
      "level": "info",
      "project": "notes",
      "host": "b55e9683-7854-4121-a56a-9bae7c3ab1da",
      "host_name": "bam-GPU",
      "seq": 43,
      "path": "notes/plan.md",
      "size": 2140,
      "sha256": "7e3b9d0a1c2f4e5d6b7a8c9d0e1f2a3b4c5d6e7f8a9b0c1d2e3f4a5b6c7d8e9f",
      "op": "edit",
      "was": {
        "sha256": "9f2c1a3b4c5d6e7f00112233445566778899aabbccddeeff0011223344556677",
        "size": 1980,
        "written_at": "2026-10-28T20:31:00.117260411Z",
        "kept": "2026-10-28T20:31:00.117Z_9f2c1a3b4c5d6e7f"
      },
      "up_ms": 406
    },
    {
      "schema": "folder-sync-event/1",
      "event": "upload",
      "at": "2026-10-28T20:41:00.415Z",
      "level": "info",
      "project": "notes",
      "host": "b55e9683-7854-4121-a56a-9bae7c3ab1da",
      "host_name": "bam-GPU",
      "seq": 43,
      "path": "notes/scratch.md",
      "size": 12,
      "sha256": "0b1c2d3e4f5a6b7c8d9e0f1a2b3c4d5e6f7a8b9c0d1e2f3a4b5c6d7e8f9a0b1c",
      "op": "edit",
      "was": {
        "sha256": "aa11bb22cc33dd44ee55ff6600112233445566778899aabbccddeeff00112233",
        "size": 10,
        "written_at": "2026-10-28T20:40:56.000Z",
        "kept": null,
        "why": "burst"
      },
      "up_ms": 411
    }
  ]
}
