{
  "schema": "folder-sync-changes/1",
  "project": "notes",
  "host_id": "b55e9683-7854-4121-a56a-9bae7c3ab1da",
  "host_name": "bam-GPU",
  "seq": 44,
  "at": "2026-10-28T20:46:12.010Z",
  "by": "machine",
  "events": [
    {
      "schema": "folder-sync-event/1",
      "event": "restore",
      "at": "2026-10-28T20:46:12.004Z",
      "level": "info",
      "project": "notes",
      "host": "b55e9683-7854-4121-a56a-9bae7c3ab1da",
      "host_name": "bam-GPU",
      "path": "notes/plan.md",
      "size": 1980,
      "sha256": "9f2c1a3b4c5d6e7f00112233445566778899aabbccddeeff0011223344556677",
      "from": "2026-10-28T20:31:00.117Z_9f2c1a3b4c5d6e7f",
      "request": "3f0e1d2c-4b5a-4968-8776-a5b4c3d2e1f0",
      "seq": 44
    }
  ]
}
