{
  "schema": "folder-sync-changes/1",
  "project": "notes",
  "host_id": "e2a0b1c2-d3e4-4f50-9a1b-2c3d4e5f6a7b",
  "host_name": "web",
  "seq": 7,
  "at": "2026-10-28T20:50:00.020Z",
  "by": "web",
  "via": "Chrome on Linux",
  "events": [
    {
      "schema": "folder-sync-event/1",
      "project": "notes",
      "host": "e2a0b1c2-d3e4-4f50-9a1b-2c3d4e5f6a7b",
      "host_name": "web",
      "seq": 7,
      "level": "info",
      "event": "restore",
      "at": "2026-10-28T20:50:00.010Z",
      "path": "hearts/clamp-24.json",
      "size": 230,
      "sha256": "beefbeefbeefbeefbeefbeefbeefbeefbeefbeefbeefbeefbeefbeefbeefbeef",
      "from": "2026-10-28T19:02:11.481Z_beefbeefbeefbeef"
    }
  ]
}
